941|5|Applicable dans tous les sites industriel utilisant des presses à injecter et des unités d'extrusion de matière plastique. L’optimisation des temps de dosage nécessite une mesure de ratio de consommation électrique (en kWh/kg par exemple) avant et après chaque phase d’optimisation.
941|6|L’optimisation du dosage permet une économie d’énergie car la vitesse de rotation de la vis est plus faible, l’échauffement de l’huile hydraulique est moindre, et donc, de manière connexe, il existe un gain sur le refroidissement. Aussi, la puissance appelée du moteur hydraulique est réduite. Par ailleurs, une meilleure homogénéité des matières transformées est annoncée.
941|10|Nécessite une campagne de mesure ; Nécessite une grande concertation avec la production.&nbsp;
941|12|Meilleure homogénéité des matières transformées ; Diminution de la consommation du moteur hydraulique.
942|1|Chauffage des moules par induction sur presse à injecter
942|2|Les moules des presses à injecter ont besoin d'un système de chauffage et refroidissement adapté pour répondre au différents cycles thermique que le plastique injecté subi. La technologie de chauffage du moule par induction est présentée comme technologie de rupture par rapport aux méthodes conventionnelles. Elle permet de chauffer un moule à une température proche de celle du matériau injecté en seulement quelque secondes ainsi qu’un refroidissement rapide. Deux moyens de chauffer le moule par induction existent aujourd’hui :&nbsp; En intégrant des inducteurs à l’extérieur du moule pour atteindre des températures de fusion allant jusqu’à 400 °C. En intégrant les inducteurs à l’intérieur du moule pour localiser le chauffage. Une&nbsp;société&nbsp;ayant déposé un brevet sur les technologies transfert ses compétences aux équipes internes après accompagnement pour le développement du moule.
942|5|Cette technologie vient s’intégrer sur des presses à injecter en remplacement d’un chauffage du moule&nbsp; de type heat &amp; cool, c'est à dire&nbsp;par cartouche électrique, par huile pressurisée ou par vapeur.
942|6|Contrairement à la technologie des cartouches électriques où la régulation est difficile du fait de la répartition de chaleur dans le moule, la technologie de chauffage par induction permet de chauffer que la partie proche de l’empreinte. La charge à refroidir étant plus faible, des économies sont faites sur le refroidissement.&nbsp;Cette technologie, permet un cycle optimisé entre le chauffage et le refroidissement. Des gains de 50 à 65 % d’économies d’énergie sont annoncés sur le chauffage des moules. Les temps de cycles sont égaux voir diminués.
942|10|Développement de nouveaux types de moules Contrat de licence avec la société qui détient le brevet
942|12|Diminution des rebuts Gains sur le refroidissement
943|1|Partage des bonnes pratiques entre les sites d'un même groupe
943|2|Permettre la comparaison et le partage entre les sites d’un même Groupe est une réelle valeur ajoutée. L’objectif n’est pas lié à une quelconque notion de compétition mais au partage de bonnes idées et d’exemples concrets d’opérations réalisées. En effet, sans le savoir, de nombreux sites ont mis en place des actions d’efficacité énergétique applicables et recherchées par les autres sites.&nbsp;Pour cela, il est pertinent de mettre en place des&nbsp;supports qui permettent partager les bonnes pratiques&nbsp;au sein du&nbsp;groupe.
943|5|Si tous les sites du Groupe ne font pas les mêmes produits et ne sont pas équipés des mêmes procédés de fabrication, il existe cependant des points communs dans la comparaison des consommations énergétiques. En effet, l'éclairage, le chauffage, l’air comprimé, la production de froid, sont des utilités pour lesquels il existe des partages de bonnes pratiques. De plus, certains process sont parfois identiques, et les solutions appliquées sont souvent transposables à plusieurs process.
943|10|Mise en place de réunions entre les différents acteurs des sites. Cela demande une implication régulière des personnes concernées.
943|12|Connaissance des bonnes pratiques Exemples concrets d’actions mises en place
944|1|Clause d'efficacité énergétique dans les contrats d'exploitation et de maintenance
944|2|Intégrer une clause d’efficacité énergétique aux contrats de maintenance et d’exploitation sur les postes consommateurs d’énergie tel que les utilités où les chaudières est source d’économies d’énergie. Cela permet d’éviter les dérives de consommation et de s’assurer du bon travail de l’exploitant. Par exemple, le fait que l’exploitant n’attende pas trop longtemps pour changer une pièce défectueuse.
944|5|La clause d’efficacité énergétique peut prendre plusieurs formes : une limite maximale de consommation ou des ratios énergétiques performants… &nbsp;
944|6|La clause devra fixer un objectif. Si l’exploitant ne l’atteint pas, il aura à payer une pénalité. Si l’objectif est dépassé, un bonus lui est rétrocédé.L’objectif peut être de plus en plus ambitieux avec le temps, jusqu’à trouver l’équilibre.
944|10|Contrats à renégocier
944|12|Maintenance suivie et efficace ; Gains assurés et contractualisés.
945|1|Niveau de pression optimum pour les pompes à vide
945|2|Produire plus de vide que nécessaire est une perte d’énergie. Le niveau de vide utilisé est peut être surdimensionné. Dans ce cadre, il est pertinent de&nbsp;regarder les manuels constructeurs des équipements consommateurs pour identifier le niveau de pression à vide dont les équipements&nbsp;ont besoin. La vérifier du niveau de pression des pompes à vide peut mettre en avant un moyen d'économiser l'énergie si la consigne se révèle être surdimensionnée.
945|5|La solution est applicable à tous les systèmes industriels utilisant&nbsp;des pompes à&nbsp;vide.
945|10|La variation de pression ne doit pas impacter le bon fonctionnement des&nbsp;équipements industriels utilisateurs
945|12|Réduction de la consommation des pompes à vide
948|1|Optimisation du diamètre des vis et fourreaux de presse à injecter et d'unité d'extrusion
948|2|La conception de la vis impacte fortement la consommation énergétique de la phase d’injection. Cette phase représente un part majeure de la consommation des presses. Par ailleurs, les fabricants innove régulièrement sur la conception des vis.&nbsp;Ils sont à même d'identifier, le diamètre approprié de la vis, la géométrie et le rapport longueur/diamètre adéquat pour une matière particulière et un taux de plastification donné. Normalement, les vis et les fourreaux doivent être vérifiés tous les six mois. A plus long terme, une réflexion plus globale peut aussi être mise en place sur la conception de la presse dans son ensemble en intégrant une contrainte supplémentaire d’efficacité énergétique. Par exemple, le nombre d’empreintes par moule, la position des empreintes dans le moule, le profil de la vis, le positionnement des injecteurs peuvent être réfléchis en intégrant le paramètre consommation d’énergie dès la conception (moteurs, éléments chauffants, refroidissement …).
948|5|Le remplacement de la vis peut être justifié à partir du moment où la consommation énergétique de la machine est élevée et que les demandes de production sont à peu près prévisibles. La diminution du diamètre d'une vis peut s’appliquer aux presses les plus dont la production a changé au cours du temps.
948|6|La plastification des matière dans la vis représentent environ 30 % des besoins énergétiques totaux des unités d'extrusion et de moulage. Le changement de diamètre d’une vis qui n’est plus adaptée peut permettre d’économiser jusqu’à 20 % de la consommation énergétique de la presse. Le temps de retour sur investissement du remplacement des vis usées est raisonnable. De manière générale, un diamètre de vis plus grand, va consommer plus car il faudra d’avantage d’énergie pour déplacer la vis et d’avantage d’énergie pour la maintenir à température. Du fait de sa surface supérieure, les pertes de chaleur vers l’extérieur vont être augmentées.Le raisonnement inverse peut alors être fait ; si une presse est continuellement en surcapacité, un diamètre de vis plus faible sera plus adapté et permettra de diminuer les consommations énergétiques.
948|10|Remplacement de la vis Arrêt de production durant toute la période de remplacement
948|11|sur la consommation énergétique de la presse.
951|1|Compteurs d'énergie thermique
951|2|Placer un compteur d'énergie thermique entre le retour et le départ des circuits de chauffage ou de refroidissement. L'appareil mesure le débit d'eau et la différence de températures entre le départ et le retour.
951|5|Permet de mesurer avec précision les consommations énergétiques des installations.
954|1|Suppression des bras morts du réseau et parties qui ne sont plus utilisées
954|2|Les bras morts créent des pertes de charge et sont soumis aux fuites qui doivent êtres compensées par les compresseurs. Deux vannes de coupures, isolant les bras mort du réseau permettent de diminuer le volume du réseau sous pression, de limiter les fuites et de diminuer la consommation d’énergie des centrales d’air car le débit à fournir pour maintenir une pression sera plus faible. L'arrivée d'air sur chaque atelier non utilisé&nbsp;peut être coupée automatiquement&nbsp;par des électrovannes ou manuellement par de vannes classiques.
954|5|La solution est applicable aux sites industriel utilisant un réseau&nbsp;d'air comprimé.&nbsp; La vérification du réseau doit être redoublée si les outils de production ont déménagés depuis l'installation.
954|6|Toute perte de charge et fuite dans le réseau doit être compensée au niveau de la centrale par la consommation électrique des compresseurs. Ces fuites et ces pertes de charges ont donc un coût non négligeable.
954|12|Diminution des fuites
960|1|Option points 10 minutes de la puissance électrique appelée
960|2|Les points 10 minutes sont les enregistrements des puissances atteintes par pas de 10 minutes. Ces données sont relevées par EDF et sont disponibles sur demande pour les contrats souscrits en tarif vert. Pour les industriels hors du tarif règlementé, certains fournisseurs d'énergie mettent à disposition des données équivalentes.
960|5|Les points 10 minutes sont utiles dans une optique de mise en place d’un suivi des consommations d’énergie. Ils permettent entre autres d’identifier les moments où les dépassements de puissance sont importants, ce qui permettrait par exemple d’envisager un échelonnement des démarrages de certaines machines par exemple ou le délestage de certains équipements aux heures où l’énergie est la plus chère (heures de pointe) afin de réduire les dépassements de la puissance souscrite.
960|6|La courbe de charge obtenue&nbsp;par les points&nbsp;10 minutes&nbsp;permet d’identifier les consommations propres à chaque période de fonctionnement et d'identifier la consommation talon. Celle ci est la consommation résiduelle durant un arrêt prolongé de production.&nbsp;Il est important d'en identifier sa source&nbsp;car&nbsp;cette puissance peut être appelée toute l'année.&nbsp;Des équipements laissés en marche sont sources de gaspillage d'énergie.
960|12|Identification des dépassements&nbsp; Les points 10 minutes peuvent mettre en évidence la consommation talon durant les périodes où la production est arrêtée.
961|1|Emplacement optimisé des systèmes de chauffage radiant
961|2|L’avantage d'un chauffage par tubes radiants est qu’il permet de chauffer une zone de manière&nbsp;localisée.&nbsp;Pour utiliser au mieux ce matériel, il est important de réaliser un zonage caractérisant les besoin réel de chauffage dans l'atelier.&nbsp;Le fait de surchauffer certaines zones de stockage entraîne une consommation inutile. Il est particulièrement intéressant&nbsp;dans les locaux industriels de moyenne ou grande hauteur où il est parfois&nbsp;inutile de chauffer tout le volume du bâtiment. Certain radiants peuvent être localisés au dessus de zones où le besoin de chauffage est inférieur voir inutile. Ces tubes radiants peuvent être replacés au dessus des ateliers.
961|5|Les systèmes de chauffage doivent être installés à une hauteur minimum de 4 mètres pour des raisons de sécurité et de confort, cette hauteur dépend aussi de la puissance des appareils. Du fait des modifications de disposition des ateliers, le système de chauffage de certaines zones peut être devenu surdimensionné pour le besoin réel.&nbsp;
961|6|Le placement des radiants doit être optimisé car il ne chauffent que la zone où vers laquelle ils sont dirigé. Un zonage de l'installation identifiant différents besoins de température de consigne en fonction des lignes de production, des utilisateurs et des besoin procédés doit être réalisé pour un chauffage de l'atelier optimum. Dans ce zonage, les&nbsp;zones ayant subies des déménagements d'outils de production doivent être analysées avec une attention toute particulière.
961|10|Emplacement parfois difficile d'accès lorsqu'ils sont situé au dessus des unités de production. Cartographie des besoin de chaleur à réaliser en amont pour avoir un chauffage optimisé dans l'atelier.
961|12|Amélioration du confort des employés.
963|1|Isolation hydraulique des chaudières quand elles ne sont pas utilisées
963|2|Une&nbsp;chaudière non isolée du résau se&nbsp;comporte&nbsp;comme un radiateur dans la chaufferie. En la maintenant à température, les pertes de chaleur vers la chaufferie sont importantes. Une solution est d'isoler hydrauliquement les chaudières quand elles ne sont pas utilisées par l'installation d'électrovannes en amont et en aval de ces chaudières. Si la solution est mise en place, il faudra respecter néanmoins les prescriptions garantissant le bon fonctionnement de la régulation en cascade.
963|5|La solution peut s'appliquer à toute chaudière sur un réseau de chauffage, d'eau chaude ou de vapeur.
963|6|Lorsqu’une chaudière n’est pas isolée du réseau hydraulique, les pertes à l’arrêt sont d’environ 2 % de la puissance de la chaudière. Ces pertes sont dues à la chaleur perdue par rayonnement et par convection.
963|10|Modification du réseau existant en y installant des électrovannes.
963|11|de diminution de puisssance par rapport à la puissance installée.
963|12|Diminution de la température dans la chaufferie Augmentation du rendement des compresseurs d'air si ils sont situés dans la même pièce.
966|1|Station météo couplée à la GTC
966|2|Le but d'une telle station météo est de récupérer des informations sur la température extérieure, la pluie, le vent… Ces informations sont transmises à la GTC qui adapte les commandes des unités de chauffage ou de climatisation, ainsi que la commandes des protections solaires.
971|1|Compresseur basse pression à vis
971|2|Installation d'un compresseur basse pression à vis dont la pression relative est inférieur à 1,5 bar.
974|1|Système de management hors certification
974|2|Les systèmes de management continue s'appuyent sur le principe d'amélioration continue. Même si le site ne va pas jusqu'à la certification, la démarche permettra d'économiser d'importantes quantités d'énergie. Les points communs des Systèmes de Management : Engagement de la Direction Définition d’une stratégie, avec des objectifs Déclinaison à l’ensemble du personnel concerné Planification des actions Mise en œuvre, par des procédures connues de tous Contrôle des résultats Corriger les écarts, amélioration continue
974|5|La solution est applicable à tous types d'acteurs : entreprises, industries, commerces, tertiaire, établissements recevant du public collectivités, établissements de santé, institutionnels…
974|6|L’Agence Internationale de l'Energie (AIE) estimait en 2008 que la mise en œuvre de pratiques de management de l’énergie permettrait d’économiser entre 5 et 22% d’énergie.
974|10|Nécessite l’implication du personnel.
974|11|de la consommation d'énergie du site
974|12|Facilite la mise en œuvre des plans d’action.
978|1|Pompe à chaleur de type eau/eau ou air/eau pour le chauffage de serres horticoles
978|2|Mise en place d'une pompe à chaleur de type eau/eau ou air/eau pour le chauffage de serres horticoles
978|5|Pour être éligible à CEE, le COP doit être supérieur à 3, mesuré conformément aux conditions de performance nominales de la norme NF-EN 1411-2 pour une température à la sortie de l'échangeur thermique inférieur égale ou supérieur à 55°C.
979|10|Nécessite un espace libre au sol. Perte de charge supplémentaire à cause de l’échangeur. Un extracteur peut être installé, asservi au fonctionnement du brûleur.
979|11|d'économie d'énergie environ.
979|12|Diminution de la température des fumées.
979|1|Récupérateur de chaleur à condensation pour serres horticoles
979|2|Mise en place d'un récupérateur de chaleur à condensation sur une chaudière à gaz destinée au chauffage d'une serres horticoles.
979|5|Pour être éligible à CEE, la mise en place doit être réalisée par un professionnel. L'attestation du bénéficiaire des travaux de la surface en m2 chauffée par la chaudière concernée par l'installation du récupérateur de chaleur à condensation est à fournir.
981|1|Certification ISO 14 001
981|2|La norme de management environnemental ISO 14 001 est applicable à tout organisme qui souhaite : -établir, mettre en œuvre, tenir à jour et améliorer un système de management environnemental, - s'assurer de sa conformité avec sa politique environnementale
986|1|Unité de production d'énergie géothermique
986|2|La chaleur géothermique est prélevée sous la surface du sol. Il en existe plusieurs classes : La géothermie TBE (Très Basse Energie) avec des températures inférieures à 30°C et une profondeur de forage inférieure à 100 m. La géothermie BE (Basse Energie) avec des températures entre 30 et 90°C. Les forages sont entre 1 500 et 2 500 m. La géothermie ME (Moyenne Energie) avec des températures entre 90 et 150°C. Les forages sont entre 1 000 et 4 000 m. La géothermie HE (Haute Energie) avec des températures supérieures à 150°C. Les forages sont entre 1 500 et 3 000 m.
986|5|L’utilisation de la géothermie est multisectorielle. Dans les secteurs résidentiels et tertiaires, elle peut servir au chauffage et au refroidissement des bâtiments par l’utilisation de pompes à chaleur géothermiques ou d’un réseau de chaleur. Dans l’industrie, elle peut être utilisée pour produire de l’eau chaude, assurer le chauffage d’un bâtiment ou générer de l’électricité. Dans l’agriculture la géothermie peut être utilisée pour chauffer les serres.
986|6|Les pompes à chaleur géothermiques ont des rendements meilleurs que ceux des pompes à chaleur classique car les températures d'évaporation et de condensation du cycle de la pompes à chaleur sont stables toute l'année.&nbsp;Le ratio de performance caractérisé par l'énergie thermique valorisée par rapport à l'énergie électrique à fournir est entre 4 et 5 : Pour un kWh électrique consommé, 4 à 5 kWh de chaleur sont produits.
986|10|Installation encore coûteuse en comparaison des technologies de chauffage concurrentes. Les pompes à chaleur avec capteurs horizontaux nécessitent une surface au sol disponible importante.
986|12|Diminution de la dépendance aux énergies fossiles par l'utilisation d'une énergie renouvelable. Pour certains types de géothermie, le même système peut servir au rafraichissement et au chauffage.
987|1|Micro éolienne pour alimenter les éclairages extérieurs
987|2|Installation de plusieurs&nbsp;micro-éoliennes pour alimenter les éclairages extérieurs.&nbsp;La faible puisance des petites éoliennes peut correspondre aux besoin d'éclairage extérieur.&nbsp;Un batterie doit être installée pour assurer un taux de couverture constant qui permettra d'alimenter en permanence l'éclairage extérieur. Une micro-éolienne produit de l'électricité en utilisant la force du vent.&nbsp;La génératrice est de plus petite puissance car&nbsp;la puissance électrique produite par l'éolienne dépend de la
987|5|Ce type de solution peut s'appliquer aux centres commerciaux, au bâtiments tertiaires et industriels&nbsp;nécessitant un éclairage extérieur. Ainsi, les éoliennes dites&nbsp;domestiques sont disponibles sur le marché ont des capacités allant de 100 W à 20 kW.
991|1|Compostage des déchets
991|2|Le compost est le produit de la fermentation à l’air libre de la matière organique par l’action de micro-organismes. Les résidus organiques se transforment par ce procédé biologique en terreau noir, odorant et riche en humus.
991|5|Le compostage peut s'effectuer chez les particulier ou en domaine&nbsp;collectif. Certaines collectivités offrent des composteurs pour diminuer l'apport de matière organique en traitement ultime et pour améliorer la qualité des sols (cultures). Dans le domaine collectif, plusieurs acteurs (agriculteurs / sylviculteurs) s'assemblent pour une valorisation plus importante. &nbsp;
991|6|La valorisation de matière organique en compost est un processus naturel qui permet un apport au sol de bonne qualité grâce à des moyens simples. Cette utilisation évite l'enfouissement ou l'incinération de déchets qui présentent encore un avantage matière. &nbsp;
991|10|Processus qui peut être long &nbsp;
991|12|Production d'un compost de qualité Réutilisation de matière première Mise en oeuvre simple
992|1|Tri des déchets dangereux
992|2|Les déchets dangereux sont des déchets présentant un risque pour l'environnement et/ou l'Homme. Ils sont répertoriés dans la législation européenne afin d'être au mieux identifiés et traités. Trier et séparer ces produits permet d'adapter la valorisation au type de déchet.
992|5|Les moyens de tri sont nombreux pour une bonne application. Nous pouvons recenser les points de tris : déchetteries (batteries, huiles moteur ...) apports volontaires dans des grandes surfaces (piles, ampoules, téléphones usagés...)
992|6|La séparation de déchets dangereux (notamment en industrie) permet d'éviter les éventuelles réactions exothermiques entre ceux-ci et assurer une sécurité physique et environnementale. &nbsp;
992|10|Dépend du comportement des usagers Doit être fait consencieusement
992|12|Valorisation plus importante et plus adaptée aux déchets Confinement de la pollution Confinement des risques pour l'environnement et les êtres humains.&nbsp;
995|1|Utilisation de papiers recyclables / recyclés
995|2|Le papier est largement utilisé, particulièrement dans les sociétés : 70-85 kg/an/salarié. Il est possible de recycler le papier pour l'utiliser à nouveau.
995|5|Dans les sociétés, il est important de veiller à la quantité de papier utilisée.&nbsp;Pour ce faire, des éco organismes s'occupent de l'avenir des papiers (Eco Folio). En étant adhérante l'entreprise s'engage dans une optique de réduction et d'amélioration de la consommation de papier.
995|6|Le papier génère de forts impacts environnementaux depuis sa fabrication jusqu'à son élimination (émission CO2, consommation d'eau pour la production, émissions gaz à effet de serre dans le cas d'une incinération ...). Réduire la quantité de papier utilisé permet de diminuer tous ces impacts et d'avancer dans une logique de développement durable. &nbsp; &nbsp;
995|10|Solution dépendante de l'implication des personnes Léger coût de collecte : 20-40 €/an/salarié.
995|12|Réduction des dépenses de papier et consommables liés : cartouches, imprimantes... Réduction de&nbsp;l'impact environnemental (rejet CO2, consommation d'eau pour la production de papier...) Diminution de la consommation de bois donc développement d'autres filières d'utilisation (chaufferie par exemple)
1001|1|Soufflettes d'air comprimé plus performantes
1001|2|Installation de soufflettes plus performantes, moins gourmandes en air comprimé afin de réduire les besoins.
1002|1|Amélioration du système d'eau glacée
1002|2|Amélioration du système d'eau glacée par l'abaissement de pression…
1004|1|Vanne permettant de moduler la pression de distribution de la vapeur
1004|2|PRV : pressure reducing valve en anglais
1008|1|Vanne permettant d'isoler le départ vapeur
1008|2|Mettre en place une vanne permettant d'isoler le départ vapeur quand la vapeur n'est plus utilisée (nuit, weekend…)
1011|1|Traitement efficaces des effluents
1011|2|Traitement efficaces des effluents
1013|1|Four pâtissier électrique de haute qualité énergétique
1013|2|Mise en place de fours pâtissier de haute qualité énergétique.
1013|5|Ces fours sont complètements isolés, sans verre ni vitres. L'isolation des murs, de l'arbre moteur principal et des zones entre les plateformes sont améliorées. Des lampes performantes sont installées qui s'éteignent quand la porte est fermée. Les tempéra
1014|1|Variation électronique de vitesse sur hotte d'aspiration des procédés
1014|2|Les moteurs tournent à faible vitesse jusqu'à ce qu'un capteur détecte que le four est ouvert. Lorsque c'est le cas, le moteur passe à vitesse maximale.
1014|5|Hotte d'aspiration des fours
1014|6|
