432|2|Il est possible de se grouper avec d’autres entités afin de mutualiser l'achat d'énergie pour augmenter les volumes et négocier le prix d'achat auprès du fournisseur. Le cahier des charges doit être très détaillé afin de bien intégrer les besoins en énergie de chaque entité.
432|5|La solution peut s'appliquer par exemple&nbsp;aux différents sites d'un groupe industriel. Cette opération n’est rentable que pour les entreprises ayant une consommation électrique annuelle supérieure à 100 MWh, afin d’amortir le coût du prestataire chargé de gérer le groupement d’achat.
432|10|Nécessité de s'accorder sur cette solution avec les autres membres du groupe d'achat.
432|12|Economie sur le tarifs d'achat d'électricité Eventuel partage de bonnes pratiques énergétiques
437|1|Démagnétiseur sur les fours
437|2|Installer un démagnétiseur sur chaque four.
441|1|"Mesure des consommations énergétiques la nuit durant le tarif ""heures creuses"""
441|2|Mesurer les consommations d'énergie en heure creuse pour vérifier que la consommation&nbsp;la nuit&nbsp;correspond à la consommation théorique des équipements&nbsp;censés fonctionner. Puis, comparer les mesures avec : le relevé des points 10 minutes du fournisseur d'électricité la comparaison du&nbsp;relevé des compteurs le soir et le matin afin de calculer une consommation moyenne durant la nuit. La liste des équipements censés fonctionner la nuit et leur consommation théorique.
441|5|Cette solution ets applicable à tous les sites industriels et tertiaires.&nbsp;Il permet d'identifier des disfonctionnements, et peut mener à mener des réflexions où l'on cherche à &nbsp;de déplacer certaines consommation de jour la nuit. En effet, le tarif heures creuses règlementé est environ 40% plus avantageux que le tarif heures pleines.
441|10|Consommation talon à reconstruire.&nbsp;Le travail de recensement des équipements peut être assez long d'autant que la nuit, les petits consommateurs peuvent être plus important en % de la&nbsp; puissance appelée que le jour.
441|12|Meilleure connaissance des consommations d'électricité de son site. Permet de mettre en évidence des&nbsp;consommations inutiles.&nbsp;
442|1|Optimisation des achats selon la variation du prix du fioul
442|2|Vérifier périodiquement les réserves de fioul. Remplir les réservoirs (si possible) quand le prix est à la baisse (généralement en été)
443|1|Utilisation des DJU pour analyser le chauffage.
443|2|Faire un graphique avec les DJU et la consommation énergétique pour le chauffage. Si les deux courbes sur le graphes ne se suivent pas, vérifier les équipements de contrôle de chauffage.
443|5|L'utilisation de Degré Jour Unifié, en relation avec la consommation énergétique peut fournir des informations intéressantes quant à l'efficacité des équipements de contrôle du chauffage. Les DJU sont disponibles sur la base de donnée Costic.
443|9|à l'année pour avoir les DJU
444|1|Suivi des performances de production
444|2|Mettre en place une procédure pour définir les facteurs de performance énergétique. Par exemple, en divisant la consommation d'électricité par le tonnage de produit finis chaque mois (KWh/tonne produite). Suivre ces facteurs de performance sur une base de
444|5|Suivre les performances de production permet de repérer rapidement les fluctuations énergétiques et d'agir rapidement afin d'en stopper les dérives.
445|1|Comparaison des performances énergétiques avec d'autres sites industriels
445|2|Comparer les consommations énergétiques avec les autres sites de production du groupe ou avec des références dans le domaine. Voir avec les centres techniques ou les syndicats professionnels pour avoir les indicateurs de référence.
445|5|Comparer les consommations par rapport aux références permet de vérifier le niveau d'efficacité énergétique et de mesurer le potentiel d'économies.
446|1|Objectifs chiffrés de réduction de consommation d'énergie
446|2|Mettre en place des indicateurs de performance pour l'activité (voir avec le centre technique ou syndicat professionnel pour obtenir les indicateurs de référence) Se fixer des objectifs chiffrés par rapport aux données regroupées Inclure ces objectifs dan
446|5|Pour motiver le personnel, des objectifs clairement définis et réalisables sont nécessaires. C'est par rapport à ces objectifs que sera validé le succès du programme d'économies d'énergie. Les objectifs doivent permettent, étape par étape, d'accéder à une
447|1|Motivation du personnel pour trouver des idées d'économies d'énergie réalisables.
447|2|Pour optimiser le taux de réussite de sa politique énergétique il faut amener le personnel à ne pas voir cela comme une contrainte. En ce sens, la communication sur les conséquences des actions engagées pour l’entreprise et pour l’environnement est importante. D’avantage encore, il est important d’arriver à susciter l’intérêt du personnel. Pour cela il est judicieux de les rendre acteurs, en leur affirmant qu’ils peuvent avoir un impact positif sur la consommation d’énergie. Une campagne à l'échelle de l'entreprise peut être mise en place dans laquelle chacun propose des solutions d'économies d'énergie documentés. Pour motiver les personnes, une prime d'environ 50 € peut être accordés pour les solutions les plus pertinentes. De même, des objectifs fixés d'économies d'énergie peuvent être visés, ou une consommation de référence à tenir.&nbsp;Pour motiver le personnel, une partie des économies d'énergie peut être partagée avec le personnel. Une telle action est motivante et valorisante pour le personnel, leur montrant qu’ils ont un rôle à jouer, que l’entreprise compte sur eux et qu’ils sont écoutés. Un espace spécifique, adresse mail, personne responsable, peut être mis en place pour permettre au personnel de faire part facilement de leur propres idées d'économies d'énergie.&nbsp;
447|5|Une solution pourrait être de leur présenter la politique d’économie d’énergie comme un projet interne à l’entreprise, mené ensemble, impliquant chacun des membres du site. &nbsp;Plus le personnel est impliqué, plus il est convaincu de l'importance de la démarche. Le personnel peut aussi être impliqué sur la gestion de l'air comprimé, de l’éclairage, des consignes de climatisation et&nbsp;de chauffage, de l’utilisation de l’eau etc.
447|10|Motivation du personnel dans la durée
447|12|Implication du personnel dans la recherche de solutions d'économies d'énergie Economie d'énergie importante
448|1|Bibliothèque des documentations constructeurs relatives aux matériels énergétiques de l'entreprise
448|2|Confier à un responsable (maintenance, énergie), l'archivage de la documentation des constructeurs. Rassembler tous les documents en un même lieu et les classer par rubriques facilement identifiables.
448|5|Cela permet de gagner en efficacité lorsqu'il faut changer une pièce.
450|1|Communication sur les bénéfices d'une politique d'économie d'énergie
450|2|Pour optimiser le taux de réussite de la politique énergétique, il faut accompagner le personnel dans la prise en compte des énergies au quotidien. En ce sens, la communication sur les conséquences des actions engagées par l’entreprise sur l’environnement est importante. D’avantage encore, il est souhaitable d’arriver à susciter l’intérêt du personnel. Pour cela il est judicieux de les rendre acteurs, en leur affirmant qu’ils peuvent avoir un impact positif sur la consommation d’énergie. &nbsp; Une solution pourrait être de leur présenter la politique d’économies d’énergie comme un projet interne à l’entreprise, mené ensemble, impliquant chacun des membres du site. A titre d'exemple, plusieurs moyens d'action sont listés ci-dessous : Faire en sorte que tout le personnel soit informé des bénéfices du programme d'économies d'énergie ; Intervenir lors des réunions périodiques du personnel pour communiquer sur les bonnes pratiques énergétiques; Mettre en place des panneaux d'affichages ; &nbsp; Assurer la promotion des économies d'énergie à travers diverses activités.
450|5|Un programme d'économie d'énergie implique tout le personnel. De hauts niveaux de performances ne peuvent être atteint sans l'implication de tout le personnel. Celui-ci sera sensibilisé et motivé si vous affichez les résultats du programme, surtout s'il est acteur des actions mises en place.
450|6|L'implication de tout le personnel sera améliorée si les résultats du programme sont affichés. Elle permettra de plus, d’optimiser des postes décentralisés comme l’éclairage, les climatisations indépendantes, la consommation d’eau ...
450|10|Campagne de communication, création de visuels Mobilisation et motivation des équipes
450|12|Diminution des consommations liées au comportement du personnel Implication du personnel
464|1|Formation d'un chauffeur à l'éco-conduite
464|2|Formation d'un chauffeur à la conduite économique.
464|5|Pour être éligible à CEE, la formation initiale, réalisée par une entreprise ou un organisme agréé, doit comporter : - Une partie théorique portant sur le fonctionnement du moteur et les principes de la conduite économique (anticipation, juste sollicitation
464|6|L’éco-conduite permet un gain direct ou indirect sur la consommation de carburant. Voici quelques pistes : Préparation : organisation des déplacements et de l'itinéraire, maintenance du véhicule (pression des pneus, filtre à air, état du moteur) Conduite souple : passer rapidement au rapport supérieur, couper le moteur après 10 secondes d’arrêt Anticipation pour éviter les freinages brusques et préférer le frein moteur
464|10|Il faut prévoir le coût de la formation ainsi que l’organisation interne. Les gains disparaissent rapidement après la formation initiale. Il est nécessaire de planifier des formations de rappel.
464|11|économie de carburant. Gains maxi en ville.
464|12|Baisse de la sinistralité (accidents) Optimisation du temps de travail Moindre usure des véhicules
480|1|Arrêt des moteurs lors des pauses
480|2|Arrêter le moteur en cas d'arrêt prolongé (au-delà de 5 minutes). De plus, la valeur financière des engins de manutention est liée au cumul horaire d'utilisation.&nbsp;Un arrêt du moteur pendant les pauses permet alors de limiter la dépréciation du matériel.
480|5|La solution s'applique aux engins de manutention pour la logistique interne des sites industriels.
480|6|Tout moteur maintenu au ralenti consomme du carburant et vieillit prématurément. La marche au ralenti du moteur fournissant le chauffage représente un gaspillage d'argent et une source de pollution.
480|10|La réussite de la solution implique l'engagement du personnel.
480|12|Economie d'énergie importante Gains sur le viellisement du matériel
482|1|Etude d'optimisation de l'usage de la chaleur au sein des procédés
482|2|Le critère de bon fonctionnement d'un procédé de production se situe classiquement sur la qualité du produit; aussi, l'optimisation des consommation est souvent oubliée. Or, l’optimisation du pilotage des process chauds est un moyen sûr d’économiser l’énergie. Une révision du besoin réel en fonction du produit s’impose alors pour limiter la production de chaleur au juste nécessaire. Des cycles, avec des niveaux de consignes variant entre les différentes phases du procédé sont à réfléchir. Ils devront alors prendre en compte l’inertie thermique de l’équipement.
482|5|"La solution s'applique à tous les procédés industriels thermiques. Une révision des installations thermiques avec la méthode du ""pincement"" permettrait d'optimiser les échanges thermiques et d'économiser grandement l'énergie. Certains logiciels sont dédiés à cette fonction."
482|6|Souvent les niveaux de température choisis sont surévalués ou correspondent au besoin de chaleur maximum qui n’est requis qu’une petite partie du temps de fonctionnement. Aussi, il arrive que les niveaux de consigne du process installé soient standardisés pour être applicables à plusieurs produits. De ce fait, le process peut ne pas être adapté de manière optimale au produit réellement fabriqué par l’entreprise.
483|1|Optimisation de la régulation des procédés thermiques et des températures de veille
483|2|L’optimisation du pilotage des process chauds est un moyen d’économiser l’énergie généralement intéressant. Souvent les niveaux de température choisis peuvent être optimisés ; par exemple, lorsqu’ils correspondent au besoin de chaleur maximum qui n’est requis qu’une petite partie du temps de fonctionnement. Aussi, il arrive que les niveaux de consigne du process installé soient standardisés pour être applicables à plusieurs produits. De ce fait, le process peut ne pas être adapté de manière optimale au produit réellement fabriqué par l’entreprise.Une révision du besoin réel en fonction du produit peut être pertinente pour limiter la production de chaleur au juste nécessaire. Des cycles avec des niveaux de consignes variant entre les différentes phases de production sont à réfléchir. Ils devront aussi prendre en compte l’inertie thermique de l’équipement.
483|5|Cette solution est applicable aux procédés thermiques qui ne sont pas utilisés de manière continue.
483|6|La marge d'optimisation est variable selon les procédés industriels.&nbsp;Par exemple, l'inertie des fours&nbsp;est très variable. Ceux ayant une inertie très faible peuvent être facilement optimisés.&nbsp;
483|10|Connaissance approfondie du comportement et de l'inertie de l'unité nécessaire.
483|11|Une conduite ou régulation inadaptée peut conduire à des surconsommation de plus de 30%
483|12|Diminution des pertes de chaleur lorsque les températures sont diminuées.
484|1|Vérification régulière de l'état général des process thermiques
484|2|Prévoir un plan d'entretien et de maintenance préventive, voir prédictive
484|5|Les dégradations ou l'encrassement des conduites d'air nuisent au bon fonctionnement de l'installation et peuvent couter 15% d'énergie supplémentaire
485|1|Contrôle de la performance des échangeurs
485|2|Mettre en place des sondes de température et un système de télé-relève permettant la surveillance et l'optimisation du fonctionnement des échangeurs.
485|5|L'encrassement et la corrosion des échangeurs constituent les principales raisons de mauvais performance énergétique et donc de surcoût pour l'entreprise. Ils peuvent également engendrer des dysfonctionnement de l'outil de production et altérer gravement la qualité des produits.
487|1|Formation du personnel à quantifier les coûts énergétiques
487|2|Former le personnel technique afin qu'il puisse mesurer l'impact des diverses actions sur les coûts énergétiques des procédés.
488|1|Comparaison des process actuels avec des process performants
488|2|Mettre en œuvre les campagnes de mesures nécessaires à l'identification des consommations et répertorier les modes d'application de la chaleur. Comparer les procédés actuels avec les procédés performants (infrarouges, micro-ondes, ultraviolets, …)
488|5|Par principe, le chauffage direct est plus efficace que le chauffage transférer et le chauffage localisé est plus efficace que le chauffage général. Or, la plupart des solutions conventionnelles utilise un fluide de transfert et une application générale.
490|1|Micro-ondes et hautes fréquences pour chauffer les produits.
490|2|Identifier les produits qui nécessitent un chauffage en masse ou bien localisé/différentiel. C'est-à-dire si certaines zones, parties ou produits d'un ensemble nécessitent d'être chauffés indépendamment du reste. Mis en place de tunnel à bande transporteur
490|5|Le chauffage par micro-ondes et le chauffage par les hautes fréquence sont un mode de chauffage direct et localisé qui agit au cœur du produit et qui peut être différentiel (chauffant certains produits et pas d'autres)
490|11|sur le chauffage de produits épais
492|1|Récupération de l'énergie des buées lors du séchage de la vapeur
492|2|Lors du séchage de la vapeur, récupérer l'énergie des buées. Répertorier les étages d'évaporation à faible retard d'ébullition car se sont les plus rentables pour installer un système de compression mécanique de vapeur ou une pompe à chaleur.
492|5|Les solutions de compression mécanique de vapeur et de pompe à chaleur peuvent permettre un séchage ne consommant que 10 à 15 KWh par kg d'eau évaporée.
500|1|Optimisation et vérification des équipements
500|2|Optimiser et vérifier les régulateurs de pressions, les filtres, les lubrificateurs, les sécheurs et les purgeurs de condensats
500|11|d'économies d'énergie
503|1|Pompes à haut rendement
503|2|Utiliser des pompes de meilleurs rendements
504|11|A vide, un moteur consomme environ 30 % de sa consommation nominale.
504|1|Arrêt des ventilateurs inutiles
504|2|Laisser un équipement en fonctionnement est source de gaspillage d’énergie. D'autant que les ventilateurs sont rarement en fonctionnement à vide.&nbsp;Lorsque le ventilateur d’extraction continue de tourner&nbsp;quand le poste de travail est inoccupé, le débit d’air extrait est le même qu’en régime nominal. De ce fait, le moteur fonctionne à pleine charge et sa consommation est maximale. Outre la sensibilisation des acteurs, il existe plusieurs solutions pour automatiser l’arrêt des équipements. Pour les ventilateurs, des horloges programmables peuvent être installées pour commander leur fonctionnement.
504|5|La solution s'applique particulièrement aux unités de production ayant une extraction de polluants&nbsp;intégrée ne fonctionnant pas de manière continue.
504|6|Même à vide la consommation du moteur n’est pas négligeable. A 10 % de charge, le moteur consomme environ 25 % de sa puissance nominale. Laisser un équipement en fonctionnement est source de gaspillage d’énergie. Par ailleurs, les moteurs fonctionnant à vide en dehors de leur besoin participent massivement à la consommation talon. Le cas du ventilateur est particulier car lorsque&nbsp; le poste de travail est inoccupé, le débit d’air extrait est le même et la consommation est égale la consommation nominale.
504|10|Procédure d'arrêt des équipement à créer et à mettre en place avec le personel. La réussite est aussi liée à la volonté des utilisateurs du poste de travail.
504|12|Gain sur le chauffage de l'atelier car en arrêtant les ventilateurs, moins d'air chaud sera évacué de l'atelier.&nbsp;
505|1|Captages spécifiques pour les pollutions localisées à la place d'un système de ventilation générale
505|2|Utiliser des captages spécifiques pour les pollutions localisées à la place d'un système de ventilation générale
508|1|Arrêt des moteurs inutiles
508|2|Identifier le besoin réel de l'exploitation et le comparer avec la puissance installée. Arrêter les moteurs inutiles en conséquence. Outre la sensibilisation du personnel, il existe plusieurs solutions pour automatiser l’arrêt des équipements. Par exemple, des horloges programmables peuvent être installées, des temporisations permettant un arrêt au bout d’un certain temps après que le besoin ait disparu, sont aussi applicables. Pour les groupes hydrauliques, des automates liés à des capteurs de pression peuvent être installés.
508|5|La solution peut être appliquée à des groupes hydraulique, à des pompes, des ventilateurs d'extraction,&nbsp;des broyeurs, des ventilateur de soufflage,&nbsp;à des convoyeurs, des agitateurs, des pompes à vide, ... Sur les pompe à vide et les ventilateurs, l'intêret est double car en dehors du besoin, la charge reste égale à la charge nominale.
508|6|Même à vide la consommation du moteur n’est pas négligeable. A 10 % de charge, le moteur consomme environ 25 % de sa puissance nominale. Laisser un équipement en fonctionnement est source de gaspillage d’énergie. Par ailleurs, les moteurs fonctionnant à vide en dehors de leur besoin participent massivement à la consommation talon.
508|10|Sensibilitation du personnel, Equipement d'automatisation de l'arrêt du moteur le plus approprié à réfléchir en amont.
508|11|A vide, un moteur consomme environ 30 % de sa consommation nominale.
508|12|Limitation des gaspillages, Réduction de la consommation talon.
509|1|Identification des systèmes inefficaces
509|2|Vérifier le point de fonctionnement du moteur qui peut avoir changé suite à des changements apportés au procédé. Identifier les vieux moteurs et les systèmes soumis à des variations de charge saisonnières.
509|5|Le rendement énergétique et l’efficacité du vieil équipement n’ont souvent reçu que peu d’attention du concepteur à l’origine. Les machines ayant subi plusieurs révisions générales sont inefficaces.
511|1|Ajustement des bagues d'étanchéité
511|2|Surveiller la quantité de fuites
511|5|Les bagues doivent normalement couler un peu pour des raisons de lubrification et de refroidissement. Le serrage excessif peut user le boîtier de l’arbre prématurément, provoquant des dommages mécaniques et des pertes d’énergie.
512|1|Arrêt des pompes inutiles
512|2|Arrêter les pompes inutiles
512|5|Cette mesure d’économie d’énergie évidente mais fréquemment oubliée peut être mise en œuvre après unediminution du besoin en débit. Le nombre de pompes en service peut être contrôlé automatiquement en installant des interrupteurs asservis à la pression sur une ou plusieurs pompes.
513|1|Gestion quotidienne du fonctionnement
513|2|Analyser les besoins de ventilation durant les différentes périodes de l'année, du mois et du jour. Mettre en place des horloges de commande. Gérer le débit en fonction de la production (quantité, type de produits, marche arrêt des machines, etc. …), de la période (année, mois, jour), l'occupation des zones de travail par le personnel et gérer le débit d'air en fonction grâce à&nbsp;des variateurs de vitesse, des détecteurs de présence,des&nbsp;horloges,&nbsp;des asservissements, ou encore par une gestion technique centralisée.
513|5|Un exemple de potentiel d’économie important est la ventilation, en dehors des heures d’ouverture, des bâtiments commerciaux ou industriels.
514|1|Réactance en série pour limiter les harmoniques
514|2|Installer les onduleurs entre le réseau perturbé et la charge sensible.Vérifier que le rendement soit bon sur toute la plage de puissance de l'onduleur (un onduleur est utilisé le plus fréquemment avec une charge de puissance allant de 40 à 60 % de sa capacité).Ajout supplémentaire de filtres actifs pour les onduleurs qui n'en possèdent pas.
514|5|Cela permet de résoudre les perturbations inter-harmonique.Parmi les différentes topologies d’onduleurs, le type double conversion est le plus adapté. Son rendement élevé (88 à 96 %) et sa haute tolérance aux perturbations en font le meilleur compromis pour la protection des installations sensibles de 1 à 1 000 kVA.Lors du choix d’un onduleur, il est important que les coûts opérationnels soient pris en compte. Les coûts&nbsp; électriques sont directement liés au rendement de l’appareil dans ses conditions réelles d’utilisation. &nbsp;
514|11|diminution du taux de flicker
515|1|Résoudre les problèmes liés aux coupures de courant
515|2|"Installer une alimentation sans interruption. Mettre en place une permutation électronique des sources. Acheter un groupe électrogène à ""temps zéro""."
516|1|Détection des fuites éventuelles de diélectrique
516|2|Vérifier le niveau de liquide si il est visible ainsi que l'étanchéité des fermetures.
518|1|Test d'isolation électrique
518|2|Effectuer un test d'isolation avec un mégohmmètre
531|5|La majeure partie des luminaires sont concernés, tant intérieurs qu’extérieurs, en industrie ou dans le tertiaire, de petite ou forte puissance. Les LED n'utilisent pas de ballast mais l'alimentation électrique est assurée par un driver qui leur est spécifique. Le remplacement de ballast ferromagnétique par des ballasts électroniques s'applique au tubes fluorescent de type T8.&nbsp;Tous les tubes T5&nbsp;doivent être&nbsp;équipés de ballast électronique pour fonctionner. L'utilisation des ballasts électronique permet en plus de coupler le système d’éclairage à des solutions d’économies d’énergie plus efficace encore, tels que des systèmes de gradation de la tension et de la luminosité des luminaires en fonction de la luminosité extérieure. Les ballast électroniques ayant un meilleur rendement, ils dégagent moins de chaleur.&nbsp;De ce fait, ils sont adaptés aux zones réfrigérées telles que les chambres froides.
